Disease,Description
poisoning due to gas,Toxic gas inhalation, respiratory issues.
alcoholic liver disease,Liver damage from chronic alcohol use.
fluid overload,Excess body fluid, swelling, breathing issues.
plantar fasciitis,Heel pain from foot tissue inflammation.
prostate cancer,Malignant prostate tumor, urinary issues.
celiac disease,Gluten intolerance, intestinal damage, diarrhea.
foreign body in the gastrointestinal tract,Swallowed object causing obstruction, pain.
cirrhosis,Liver scarring, impaired function, jaundice.
alzheimer disease,Progressive dementia, memory loss, confusion.
premature atrial contractions (pacs),Irregular atrial heartbeats, often benign.
heat exhaustion,Overheating causing weakness, nausea, dehydration.
anal fissure,Painful tear in anal lining, bleeding.
tinnitus of unknown cause,Persistent ear ringing without clear cause.
osteomyelitis,Bone infection, pain, swelling, fever.
stenosis of the tear duct,Blocked tear drainage, watery eyes.
pancreatic cancer,Malignant pancreas tumor, abdominal pain.
gastroparesis,Delayed stomach emptying, nausea, bloating.
stomach cancer,Malignant stomach tumor, pain, weight loss.
genital herpes,Herpes virus causing genital sores.
uterine atony,Weak uterine contractions post-delivery, bleeding.
peripheral arterial embolism,Artery blockage, limb pain, tissue damage.
brain cancer,Malignant brain tumor, headaches, seizures.
persistent vomiting of unknown cause,Unexplained chronic vomiting, varying causes.
coronary atherosclerosis,Artery plaque buildup, heart disease risk.
intertrigo (skin condition),Skin fold inflammation, redness, irritation.
hydrocephalus,Brain fluid buildup, pressure, headaches.
tension headache,Stress-related head pain, tightness.
cerebral edema,Brain swelling, pressure, neurological issues.
polymyalgia rheumatica,Muscle pain, stiffness, elderly onset.
gonorrhea,Bacterial STI, discharge, painful urination.